niat,Jawapan
bayaranbalik_cari,"Dalam kebanyakan kes, jumlah bayaran balik anda bergantung pada dasar pembatalan tempahan anda dan apabila anda membatalkan tempahan. Anda boleh mendapatkan jumlah bayaran balik dan dasar pembatalan khusus untuk tempahan anda dengan mula membatalkan penginapan anda atau Pengalaman anda. Anda juga boleh mengetahui tentang dasar pembatalan tempahan anda dengan pergi ke Trips dan memilih perjalanan anda, atau dengan menyemak e-mel pengesahan tempahan anda. Anda mungkin layak mendapat bayaran balik penuh atau bayaran balik yang lebih besar daripada bayaran balik standard dasar pembatalan Hos anda jika: Anda perlu membatalkan kerana keadaan yang mengurangkan Anda perlu membatalkan kerana alasan yang layak dilindungi oleh Polisi Tempahan Semula dan Bayaran Balik Airbnb Semasa anda kekal, anda mengalami isu yang diliputi oleh Dasar Tempahan Semula dan Bayaran Balik Airbnb sekiranya rancangan anda berubah disebabkan oleh COVID-19, semak sama ada Polisi Keadaan Meringankan terpakai pada tempahan anda. Bayaran balik untuk penginapan yang dibatalkan akibat COVID-19 memerlukan bukti penyakit atau pendedahan dalam tempoh 14 hari selepas daftar masuk. Cth: Ujian positif COVID-19 Nota doktor Notis daripada kerajaan tempatan yang mengatakan anda telah terdedah Tangkapan skrin pemberitahuan daripada aplikasi pengesanan kenalan Keputusan ujian positif daripada ahli isi rumah anda"
bayaranbalik_bila,"Berita baik—jika anda layak menerima bayaran balik, anda akan mendapatnya secara automatik dalam masa 10 hari. Mungkin lebih awal lagi. Kami akan menghantar bayaran balik anda sebaik sahaja anda membatalkan kaedah pembayaran yang anda gunakan semasa anda menempah tempahan, tetapi bank atau pengeluar kad kredit anda mungkin mengambil masa yang lebih lama untuk menyampaikannya kepada anda. Semuanya bergantung pada cara anda membayar dan tempat tinggal anda: Kredit Airbnb untuk Kerja 24 jam Kredit hadiah Airbnb Kredit Hongbao PayPal 1 hari perniagaan Alipay WeChat Bayar Sehingga 5 hari perniagaan iDEAL Sofort Überweisung Sehingga 15 hari perniagaan Kad kredit utama, termasuk kredit prabayar dan kad debit Kaedah pembayaran lain Apple Pay Google Pay Postepay Sehingga 2 penyata kad kredit Aura Elo Hipercard Kad kredit utama di Brazil sahaja Nota: Jika akaun kaedah pembayaran asal anda telah ditutup, bayaran balik yang dihantar oleh Airbnb tidak akan diproses. Jika ini berlaku, kami akan menghubungi anda dan anda akan mempunyai pilihan untuk mengemas kini kaedah pembayaran anda."
bayaranbalik_automatik,Bayaran balik yang layak akan diproses sebaik sahaja anda mengklik batal. Kami memproses bayaran balik secara automatik melalui kaedah pembayaran yang anda gunakan semasa anda menempah tempahan.
bayaranbalik_minta,"Jika anda ingin meminta bayaran balik sebelum atau selepas perjalanan anda, permintaan bayaran balik untuk sebarang jumlah boleh dikendalikan melalui chatbot kami. Anda hanya boleh klik pada arahan atau taip permintaan anda yang ingin anda buat dan borang akan muncul di sudut kanan skrin anda di bahagian bawah.

Kami mengesyorkan anda membincangkan sebarang jumlah bayaran balik dengan Hos anda melalui urutan mesej Airbnb anda sebelum menyerahkan permintaan di Pusat Penyelesaian. Walau bagaimanapun, jika anda dan Hos anda tidak dapat mencapai persetujuan, anda akan mempunyai pilihan untuk meminta bantuan Airbnb mencari penyelesaian. Isu mesti dilaporkan kepada Airbnb dengan 72 jam penemuan untuk layak di bawah Dasar Tempahan Semula dan Bayaran Balik kami

Jika anda mengalami isu semasa penginapan anda, kami akan membantu anda meminta Hos anda membetulkannya, meminta bayaran balik atau meminta untuk membatalkan bayaran balik penuh. Adalah penting untuk menyerahkan permintaan dalam masa 24 jam selepas menyedari isu perjalanan. Hos anda akan mempunyai 1 jam untuk membalas. Jika mereka menolak atau tidak membalas, anda boleh meminta Airbnb untuk membantu."
bayaranbalik_layak_perjalanan,"Beberapa isu perjalanan memerlukan sedikit bantuan tambahan. Jika anda mengalami mana-mana daripada ini, kemungkinan besar anda dilindungi oleh Dasar Tempahan Semula dan Bayaran Balik: Tiada akses kepada penyenaraian, contohnya, jika Hos memberikan kod peti kunci yang salah dan kini mereka tidak dapat dihubungi Space isn't safe atau bersih semasa ketibaan, seperti linen kotor, atau bahaya keselamatan Kemudahan utama hilang atau tidak berfungsi, sebagai contoh, kolam yang anda angan-angankan rosak Tempat tidak seperti yang diterangkan dalam perihalan penyenaraian, mungkin bilangan bilik atau katil adalah berbeza, atau ciri kebolehaksesan tiada Jika anda perlu menyerahkan tuntutan, pastikan anda: Mengumpul bukti: Dokumen isu dengan foto atau video Hubungi kami: Mesej atau hubungi Airbnb dalam masa 24 jam selepas menghadapi masalah Tetap berhubung: Kami akan menghubungi anda dengan langkah seterusnya yang khusus untuk anda"
bayaranbalik_cepat,"Malangnya, yang ini di luar tangan kami. Semuanya bergantung pada masa pemprosesan kaedah pembayaran anda."
bayaran balik_pembatalan,"Anda sudah bersedia untuk mengembara dan kini sesuatu telah muncul. Ketahui cara membatalkan penginapan atau Pengalaman anda. Dan sila ambil perhatian bahawa bayaran balik anda tertakluk pada dasar pembatalan Hos. Amaun bayaran balik anda juga mungkin dipengaruhi oleh: Yuran pembersihan: Sentiasa dikembalikan jika anda membatalkan sebelum daftar masuk. Yuran perkhidmatan Airbnb: Yuran perkhidmatan akan dikembalikan jika anda membatalkan tempahan semasa tempoh pembatalan percuma untuk tempahan anda. Yuran hartanah di tapak: Jika hotel atau Hos profesional lain mengutip yuran hartanah di tapak, sebarang bayaran balik yuran tersebut adalah mengikut budi bicara Hos."
bayaran_airbnb_servis,"Untuk membantu Airbnb berjalan lancar dan untuk menampung kos perkhidmatan seperti sokongan pelanggan 24/7, kami mengenakan bayaran perkhidmatan apabila tempahan disahkan. Terdapat 2 struktur yuran yang berbeza untuk penginapan: yuran split dan yuran Hos sahaja. 1. Split-fee Struktur yuran ini adalah yang paling biasa dan dibahagikan antara Hos dan tetamu. Yuran hos Kebanyakan Hos membayar yuran 3%, tetapi ada yang membayar lebih, termasuk: Hos Airbnb Plus Hos dengan penyenaraian di Itali Hos dengan polisi pembatalan Super Strict Yuran ini dikira daripada jumlah kecil tempahan (kadar setiap malam + yuran pembersihan + yuran tetamu tambahan, jika berkenaan—tidak termasuk yuran dan cukai Airbnb) dan ditolak secara automatik daripada pembayaran Hos. Untuk menyemak yuran perkhidmatan untuk tempahan: Pergi ke Sejarah transaksi Pilih kod tempahan Di Bawah Pembayaran, cari Yuran Perkhidmatan Airbnb Yuran tetamu Kebanyakan yuran perkhidmatan tetamu adalah di bawah 14.2% daripada jumlah kecil tempahan (kadar setiap malam + yuran pembersihan + yuran tetamu tambahan, jika berkenaan—tidak termasuk yuran dan cukai Airbnb). Yuran ini berbeza-beza berdasarkan pelbagai faktor dan ditunjukkan semasa daftar keluar sebelum anda menempah supaya anda tahu apa yang diharapkan. 2. Yuran hos sahaja Dengan struktur ini, keseluruhan yuran ditolak daripada pembayaran Hos. Biasanya 14–16%, walaupun Hos dan Hos Airbnb Plus dengan dasar pembatalan Super Strict mungkin membayar lebih. Yuran ini adalah wajib untuk penyenaraian hospitaliti tradisional–seperti hotel, pangsapuri servis, dsb., serta hos yang disambungkan dengan perisian (melainkan kebanyakan penyenaraian mereka berada di AS, Kanada, Bahamas, Mexico, Argentina, Taiwan atau Uruguay ). Semua Hos dengan sambungan API akan didaftarkan ke Yuran Hos Sahaja dan tidak akan dapat menarik diri. Caj VAT Bergantung pada undang-undang bidang kuasa yang terlibat, VAT boleh dikenakan di atas yuran di atas. Yuran perkhidmatan termasuk VAT jika berkenaan. Kami berhak untuk menukar yuran perkhidmatan kami pada bila-bila masa, dan akan memberi anda notis awal tentang sebarang perubahan yuran sebelum ia berkuat kuasa. Sebarang perubahan yuran tidak akan menjejaskan tempahan yang dibuat sebelum tarikh kuat kuasa perubahan yuran."
penentuan_harga,"Jumlah harga tempahan Airbnb anda adalah berdasarkan kadar setiap malam yang ditetapkan oleh Hos, serta yuran atau kos yang ditentukan oleh Hos atau Airbnb. Jenis yuran Yuran perkhidmatan Airbnb: Yuran perkhidmatan tetamu yang dikenakan oleh Airbnb—ini menyediakan sokongan komuniti 24/7 dan membantu semuanya berjalan lancar. Bayaran pembersihan: Dikenakan oleh beberapa Hos untuk menampung kos pembersihan ruang mereka. Bayaran tetamu tambahan: Dikenakan oleh beberapa Hos untuk setiap tetamu tambahan melebihi nombor yang ditetapkan. Deposit keselamatan: Hos yang mengurus penyenaraian mereka dengan perisian berkaitan API boleh menetapkan deposit keselamatan menggunakan ciri yuran luar talian kami. Ketahui lebih lanjut tentang deposit keselamatan. Cukai Nilai Ditambah (VAT, JCT dan GST): Dicaj kepada tetamu yang tinggal di negara tertentu—ketahui lebih lanjut tentang VAT. Cukai tempatan: Dicaj berdasarkan lokasi tempat Hos—ketahui lebih lanjut tentang cukai tempatan. Pembayaran Anda akan dicaj sebaik sahaja Hos menerima permintaan tempahan anda, atau serta-merta jika anda menggunakan tempah Segera. Anda mungkin boleh membahagikan jumlah kos tempahan anda pada pelbagai pembayaran jika tempahan anda memenuhi kriteria tertentu, atau anda boleh membayar jumlah penuh sekali gus."
bayaran_bayaran_perkhidmatan,"Jika anda perlu membatalkan (Tidak mengapa, perkara berlaku!), anda mungkin boleh menerima bayaran balik untuk keseluruhan tempahan anda, termasuk yuran perkhidmatan. Jadi bagaimana ia berfungsi? Paling penting: semak dasar pembatalan tempahan anda untuk mengetahui sama ada yuran perkhidmatan akan dikembalikan. Yuran perkhidmatan akan dikembalikan jika anda membatalkan sebelum tempoh pembatalan percuma tempahan anda tamat (atau bila-bila masa sebelum daftar masuk, untuk tempahan di Itali dan pengembara Korea Selatan dalam sesetengah kes) atau jika hos memutuskan untuk membayar balik anda sepenuhnya selepas anda membatalkannya. Bayaran balik untuk kadar setiap malam dan yuran lain Polisi pembatalan Hos anda masih terpakai pada sebarang bayaran lain yang berkaitan dengan tempahan anda."
penetapanharga_tepat,"Sama seperti merancang perjalanan pada bulan Julai sangat berbeza daripada satu pada bulan Februari, begitu juga harganya. Untuk melihat harga paling tepat bagi perjalanan anda, tambah tarikh semasa mencari tempat. kenapa? Kerana sesetengah Hos mempunyai harga tersuai yang mengatasi harga lalai atau minimum untuk tarikh atau tempoh masa tertentu (termasuk hari cuti, hujung minggu dan tempahan selama seminggu atau sebulan). Jika Hos anda mengemas kini harga untuk tempat mereka sebelum anda meminta perubahan, tempahan baharu anda akan menunjukkan harga ini."
harga_palang,"Berita baik! Anda ditawarkan tawaran hebat. Kami hanya memotong harga apabila harga yang ditawarkan adalah sekurang-kurangnya 10% lebih rendah daripada biasa untuk malam tertentu. Siapa yang tidak suka mengetahui mereka melakukan perkara yang baik? Jenis diskaun Diskaun mingguan atau bulanan: Hos kadangkala menawarkan diskaun pada harga setiap malam untuk penginapan yang sekurang-kurangnya 7 hari. Diskaun awal: Hos boleh menawarkan diskaun pada harga setiap malam apabila tetamu menempah beberapa hari sebelum perjalanan mereka. Sebagai contoh, Hos mungkin menetapkan diskaun 15% untuk penginapan yang ditempah sekurang-kurangnya 2 bulan lebih awal. Penurunan harga: Hos menurunkan harga mereka untuk tarikh tertentu yang mereka pilih. Cara kami mengira diskaun sebenar untuk penurunan harga Kami menjejaki semua harga Hos dari semasa ke semasa. Dengan melihat harga median sepanjang 30 hari sebelumnya, kami menghitung harga purata setiap Hos. Jika Hos menurunkan harga mereka sebanyak 10% atau lebih di bawah median untuk tarikh tertentu, kami menyerlahkan penjimatan dengan memotong harga asal. Cara ia berfungsi Katakan anda mencari malam pada bulan Jun. Kita dapat melihat bahawa sepanjang 30 hari yang lalu, Hos telah menukar harga untuk malam itu pada 4 kesempatan berbeza. Kami mengira harga median untuk malam ini dengan menambah 2 harga tengah bersama-sama, dan membahagikannya dengan 2. Harga 1: $90 Harga 2: $100 Harga 3: $125 Harga 4: $140 Harga median: ($100 + $125) / 2 = $112.50 Seterusnya, kami membandingkan harga median ini dengan harga semasa malam yang anda cari. Jika harga semasa adalah sekurang-kurangnya 10% kurang daripada median ($112.50 dalam contoh ini), kami menunjukkan kepada anda harga median yang dicoret, bersebelahan dengan harga diskaun. Cth: $112.50 $100"
harga_malam,"Jika anda menyerahkan permintaan pertukaran perjalanan kepada Hos anda dan mereka menerima, tempahan anda akan dikemas kini untuk mencerminkan perubahan pada kadar harian semasa Hos anda. Seperti mana-mana hotel atau B&B, Hos anda mungkin telah menaikkan (atau menurunkan, jika anda bernasib baik) harga sejak anda menempah tempahan anda pada asalnya."
bayaran_pembersihan,"Siapa yang tidak suka tiba di ruang yang bersih dan kemas? Yuran pembersihan ialah caj sekali sahaja untuk membersihkan ruang yang anda tinggal dan ditetapkan oleh Hos. Ia merupakan jumlah tambahan di atas kadar setiap malam apabila anda menempah penyenaraian. Yuran ini meliputi perbelanjaan tambahan yang ditanggung Hos apabila menyediakan tempat mereka untuk tetamu tiba atau selepas mereka keluar. Perkara yang perlu diketahui tentang bayaran pembersihan Dalam hasil carian penyenaraian, anda akan melihat kadar setiap malam yang termasuk yuran pembersihan dibahagikan dengan jumlah malam perjalanan. Apabila anda membuat permintaan perjalanan, kadar setiap malam dan bayaran pembersihan akan disenaraikan secara berasingan dalam pecahan harga. Yuran pembersihan adalah sebahagian daripada jumlah tempahan dan tidak dikembalikan kepada tetamu pada akhir perjalanan."
kupon_bagaimana,"Pastikan anda menggunakan kupon sebelum anda membuat tempahan dan ingat bahawa jika anda membatalkan tempahan, kupon tidak boleh digunakan lagi. Untuk menggunakan kupon anda: Klik Masukkan kupon (di bawah kaedah pembayaran anda) pada halaman pembayaran Pilih kupon atau masukkan kod kupon anda dan klik Guna Butiran tambahan Anda tidak boleh menggunakan kupon selepas anda menempah: Walaupun anda menghubungi Sokongan Airbnb, kami tidak boleh menggunakan kupon semasa atau tamat tempoh selepas anda menempah tempahan (masa hadapan atau masa lalu). Jika anda membatalkan, kupon tidak akan dikembalikan: Bayaran balik adalah berdasarkan dasar pembatalan hos dan kami tidak boleh memulihkan atau mengeluarkan semula kupon yang anda tebus pada masa lalu. Tarikh tamat tempoh tidak boleh dilaraskan: Setelah kupon tamat tempoh, tarikh tamat tempoh tidak boleh dilanjutkan atau mendapatkan kupon gantian. Kupon tamat tempoh tidak boleh digunakan untuk tempahan yang lalu. Hadkan satu kupon bagi setiap tempahan: Tiada cara untuk menggunakan pelbagai kupon."
kupon_umum,"Pastikan anda menggunakan kupon sebelum anda membuat tempahan dan ingat bahawa jika anda membatalkan tempahan, kupon tidak boleh digunakan lagi. Untuk menggunakan kupon anda: Klik Masukkan kupon (di bawah kaedah pembayaran anda) pada halaman pembayaran Pilih kupon atau masukkan kod kupon anda dan klik Guna Butiran tambahan Anda tidak boleh menggunakan kupon selepas anda menempah: Walaupun anda menghubungi Sokongan Airbnb, kami tidak boleh menggunakan kupon semasa atau tamat tempoh selepas anda menempah tempahan (masa hadapan atau masa lalu). Jika anda membatalkan, kupon tidak akan dikembalikan: Bayaran balik adalah berdasarkan dasar pembatalan hos dan kami tidak boleh memulihkan atau mengeluarkan semula kupon yang anda tebus pada masa lalu. Tarikh tamat tempoh tidak boleh dilaraskan: Setelah kupon tamat tempoh, tarikh tamat tempoh tidak boleh dilanjutkan atau mendapatkan kupon gantian. Kupon tamat tempoh tidak boleh digunakan untuk tempahan yang lalu. Hadkan satu kupon bagi setiap tempahan: Tiada cara untuk menggunakan pelbagai kupon."
kupon_tidak_berfungsi,"Semak semula untuk memastikan anda menggunakan kod yang betul. Jika ia masih tidak berfungsi, ingat perkara ini: Jika kupon telah tamat tempoh, tiada cara untuk mengaktifkannya semula. Hanya satu kupon boleh digunakan bagi setiap tempahan. Kupon hanya boleh digunakan sekali sahaja. Jika anda membatalkan tempahan yang telah ditempah menggunakan kupon, kupon tersebut tidak sah lagi. Untuk tempahan 28 malam atau lebih, jika anda memilih pelan pembayaran semasa anda menempah, kupon akan mengurangkan jumlah harga dan jumlah itu akan dibahagikan kepada pembayaran. Hanya kupon yang dikeluarkan oleh Airbnb diterima. Jika anda menggunakan kurang daripada jumlah penuh kupon, sebarang jumlah diskaun yang tidak digunakan akan dilucuthakkan. Kupon tidak boleh digunakan pada tempahan yang anda buat pada masa lalu. Hanya orang yang menerima kupon boleh menggunakannya di Airbnb. Tiada cara untuk memindahkan kupon kepada orang lain. Kupon hanya boleh digunakan untuk jenis tempahan yang dikeluarkan. Contohnya, jika kupon hanya boleh digunakan untuk penginapan, maka ia tidak boleh digunakan untuk pengalaman atau apa-apa lagi di Airbnb. Jika tempahan yang ditempah dengan kupon diubah kemudian hari, anda perlu membayar perbezaannya dengan kaedah pembayaran anda, atau, jika perubahan tersebut mengakibatkan bayaran balik, kami akan mengkreditkan kaedah pembayaran anda untuk perbezaan tersebut. Walau bagaimanapun, anda tidak akan menerima bayaran balik untuk jumlah kupon dan kupon tidak akan dapat digunakan lagi. Kupon mungkin mempunyai had tertentu; lihat Terma & Syarat yang diedarkan bersama kupon untuk butiran."
kupon_hos_batal,"Jika hos anda membatalkan tempahan yang anda gunakan kupon, kod kupon anda akan kekal aktif dan boleh digunakan untuk tempahan lain."
syarat_kupon,"Terma dan Syarat berikut digunakan untuk kupon untuk digunakan pada platform Airbnb (“Kupon Airbnb''). Syarat tambahan lain yang disediakan, bersama-sama dengan kupon, juga terpakai untuk penggunaan Kupon Airbnb oleh anda. Kupon Airbnb adalah penggunaan sekali sahaja dan tidak boleh dikembalikan. Kupon tidak boleh ditebus untuk wang tunai, kad hadiah atau untuk pembelian sebelumnya, dan tidak boleh dipindahkan atau digabungkan dengan tawaran, kupon atau diskaun lain. Airbnb berhak untuk mendapatkan sebarang remedi, termasuk membatalkan kupon ini, dalam kes disyaki penipuan, penyalahgunaan, pelanggaran Syarat Perkhidmatan kami, Syarat Perkhidmatan Pembayaran atau kesilapan teknikal. Sila rujuk di bawah untuk syarat tambahan bagi Kupon Tempahan Semula tertentu. Kupon Tempah Semula Sebagai sebahagian daripada AirCover, apabila Hos membatalkan tempahan anda secara tidak dijangka atau Isu Perjalanan lain mengganggu penginapan, Airbnb mungkin mengeluarkan Kupon Tempahan Semula kepada anda. Kupon hanya sah untuk penginapan dengan tarikh daftar masuk dalam tempoh satu tahun dari tarikh kupon dikeluarkan. Kupon Tempah Semula tamat tempoh 30 hari dari pengeluaran. Untuk maklumat lanjut, rujuk komunikasi anda daripada Airbnb pada tarikh tamat tempoh kupon anda. Kupon Tempahan Semula hanya boleh digunakan untuk tempahan penginapan dengan nilai tempahan (tidak termasuk cukai atau yuran) yang sama atau lebih besar daripada nilai Kupon Tempahan Semula."
kredit_rujukan,"Jika anda memperoleh kredit perjalanan dengan menyertai Airbnb melalui pautan jemputan Jika anda mendaftar untuk Airbnb menggunakan pautan rujukan, kupon rujukan anda akan dipaparkan secara automatik pada halaman pembayaran apabila anda membayar untuk tempahan pertama anda yang layak. Anda mesti mempunyai tempahan yang layak untuk layak mendapat kredit perjalanan rujukan. Tempahan yang layak mesti memenuhi nilai minimum, yang tidak termasuk sebarang cukai atau yuran. Oleh kerana jumlah minimum boleh berbeza-beza, anda harus merujuk kepada e-mel jemputan yang anda terima atau pergi ke halaman jemputan untuk melihat butiran tentang tempahan yang layak. Jika anda memperoleh kredit perjalanan dengan menjemput rakan untuk menyertai Airbnb Jika rakan anda mendaftar untuk Airbnb menggunakan pautan rujukan anda dan melengkapkan tempahan yang layak, kredit perjalanan akan ditambahkan secara automatik pada akaun anda. Kredit perjalanan anda akan dipaparkan pada halaman pembayaran apabila anda membayar untuk tempahan anda yang seterusnya. Ingat, anda akan mendapat kredit perjalanan sebaik sahaja rakan anda melengkapkan perjalanan yang layak. Jika kredit perjalanan anda belum muncul lagi, ini bermakna rakan anda belum melengkapkan perjalanan mereka atau tempahan mereka tidak layak."
kredit_hilang,"Jika anda mendaftar untuk Airbnb menggunakan pautan rujukan, kupon rujukan akan muncul secara automatik pada halaman pembayaran apabila anda membayar untuk tempahan pertama anda yang layak. Baca lebih lanjut mengenai tempahan yang layak dan kredit perjalanan. Jika kupon rujukan anda tidak muncul, anda boleh mengikuti langkah ini untuk mendapatkan semula kredit anda. Anda memerlukan pautan rujukan yang anda terima, yang mungkin dalam e-mel anda, mesej teks atau dari siaran media sosial. Sebagai alternatif, anda boleh menggunakan alamat e-mel orang yang merujuk anda—tetapi itu hanya akan berfungsi jika alamat e-mel yang sama yang mereka gunakan untuk akaun Airbnb mereka."
kad_hadiah_beli,"Anda boleh mendapatkan kad hadiah Airbnb di kedai dan dalam talian, atau terus daripada kami! Bergantung pada tempat anda membeli kad hadiah anda, anda boleh mendapatkan kad fizikal atau kad digital yang dihantar kepada anda atau penerima anda. Buat masa ini, kad hadiah hanya tersedia di negara berikut: Australia Austria Belgium Kanada Finland Perancis Jerman Ireland Itali Mexico* Belanda New Zealand Sepanyol Sweden United Kingdom Amerika Syarikat * - Kad hadiah hanya tersedia untuk pembelian melalui peruncit pihak ketiga Maklumat penting: Pada masa ini, kad hadiah hanya boleh dibeli untuk seseorang dalam negara atau wilayah yang sama dengan anda dan penerima mesti mempunyai kaedah pembayaran yang sah dalam negara tersebut. Jika anda berada di negara dalam kawasan Kawasan Ekonomi Eropah (EEA)—Perancis, Itali, Sepanyol, Jerman, Austria, Belgium, Finland, Ireland, Belanda dan Sweden—anda boleh membeli kad hadiah untuk orang lain di salah satu negara EEA tersebut selagi penerima mempunyai kaedah pembayaran yang sah dalam negara tersebut. Setelah kad hadiah ditebus, ia boleh digunakan untuk sebarang penginapan atau Pengalaman di seluruh dunia."
invois_vat_tetamu,"Anda boleh mengakses invois VAT individu untuk setiap tempahan atau memuat turun invois VAT secara pukal di wilayah tempat Airbnb menjana invois VAT. Untuk mengakses invois VAT untuk tempahan: Pergi ke Tempahan (anda perlu log masuk ke akaun anda pada komputer meja atau penyemak imbas) Jika tempahan yang anda cari tidak dipaparkan, klik tab Selesai Klik tiga titik di sebelah tempahan Pilih Invois VAT Untuk mengakses invois VAT secara pukal untuk tempahan anda: Pergi ke Tempahan (anda perlu log masuk ke akaun anda pada komputer desktop atau penyemak imbas) Pilih Eksport Pilih Muat turun invois VAT Pilih jenis Fail anda ( CSV atau format PDF) dan pilih Bulan yang anda ingin muat turun Pilih Muat Turun Nota: Muat turun pukal akan termasuk invois VAT untuk tempahan dengan tarikh mula yang berlaku dalam bulan yang dipilih. Jika anda menambahkan nombor ID VAT yang disahkan pada akaun anda, ia akan disertakan pada invois VAT yang dibuat selepas itu. Untuk butiran tempahan, semak pengesahan Hos anda."
resit_tambah_maklumat,"Sebaik sahaja resit telah dikeluarkan, anda tidak boleh membuat penambahan atau pengeditan padanya. Resit pengebilan anda adalah berdasarkan maklumat yang anda berikan semasa membuat tempahan. Walau bagaimanapun, anda boleh membuat perubahan pada jadual perjalanan anda selepas anda membuat tempahan. Ini termasuk menambah maklumat seperti: Nama dan nombor tetamu (boleh diedit sehingga tempahan anda tamat) Alamat perniagaan atau pengebilan (boleh diedit pada bila-bila masa) Nombor pasport Tarikh lahir Nama tetamu Nombor pengenalan cukai"
resit_cari,"Pergi ke Perjalanan dan pilih perjalanan yang anda inginkan resitnya Klik Tunjukkan lagi rancangan perjalanan Dalam Tunjukkan butiran, klik Dapatkan resit Pilih pembayaran dan klik Dapatkan resit"
concur_triplink," Pautkan akaun anda Untuk memautkan akaun Airbnb dan Concur TripLink anda: Pergi ke Airbnb dalam Pusat Aplikasi Concur, dan klik Sambung Log masuk ke akaun Airbnb anda yang sedia ada atau, jika anda belum mempunyai akaun, buat yang baharu Setelah akaun anda dipautkan, anda boleh memaparkan resit untuk sebarang tempahan Airbnb dalam akaun Concur anda dengan menandakan kotak di sebelah Hantar tempahan ini kepada Concur pada halaman daftar keluar permintaan tempahan."
concur_triplink_nyahpaut,"Anda perlu menyahpaut akaun anda dengan melog masuk ke akaun anda menggunakan penyemak imbas (bukan menggunakan apl Airbnb). Untuk menyahpaut akaun Airbnb dan Concur TripLink anda: Pergi ke Akaun Pilih Tetapan Di Bawah Nyahpaut Daripada Concur, klik Nyahpaut"
